{"ablation_rows": [{"expected_effect": "all current P8 evidence is present and auditable", "primary_metric": 1.0, "removed_component": null, "status": "ready", "variant": "full_system"}, {"expected_effect": "without retrieval evidence, expected local-stat lemma recall is not audited", "primary_metric": 0.0, "removed_component": "retrieval", "status": "degraded", "variant": "no_retrieval"}, {"expected_effect": "without SFT examples, the system has no domain-adaptation trace data", "primary_metric": 0.0, "removed_component": "sft", "status": "degraded", "variant": "no_sft"}, {"expected_effect": "without DPO pairs, the prover lacks Lean-labeled contrast against invalid premises", "primary_metric": 0.0, "removed_component": "dpo", "status": "degraded", "variant": "no_dpo"}, {"expected_effect": "without process rewards, training falls back to sparse proof-complete feedback only", "primary_metric": 0.0, "removed_component": "process_reward", "status": "degraded", "variant": "no_process_reward"}, {"expected_effect": "without curation, generated lemmas could bypass duplicate, non-vacuity, or reuse checks", "primary_metric": 0.0, "removed_component": "curation", "status": "degraded", "variant": "no_curation"}], "baseline": "seed-registry", "benchmark_task_count": 94, "components": [{"component": "retrieval", "disabled_effect": "without retrieval evidence, expected local-stat lemma recall is not audited", "enabled_evidence": "held-out baseline mean premise recall is 1.000 from expected-premise usage rows", "enabled_metric": 1.0, "ready": true}, {"component": "sft", "disabled_effect": "without SFT examples, the system has no domain-adaptation trace data", "enabled_evidence": "89 verified no-placeholder SFT examples are present in the manifest", "enabled_metric": 89, "ready": true}, {"component": "dpo", "disabled_effect": "without DPO pairs, the prover lacks Lean-labeled contrast against invalid premises", "enabled_evidence": "89 chosen/rejected DPO pairs are present; 89 rejected attempts are Lean-labeled", "enabled_metric": 89, "ready": true}, {"component": "process_reward", "disabled_effect": "without process rewards, training falls back to sparse proof-complete feedback only", "enabled_evidence": "94 GRPO process-reward tasks expose 11 reward components", "enabled_metric": 94, "ready": true}, {"component": "curation", "disabled_effect": "without curation, generated lemmas could bypass duplicate, non-vacuity, or reuse checks", "enabled_evidence": "15/15 proposal, non-vacuity, and proof-cost gates pass; 5 placeholder-ledger entries remain blocked from library promotion", "enabled_metric": 15, "ready": true}], "concrete_chain_passed": true, "evidence_summary": {"blocked_placeholder_ledger_entries": 5, "curation_gate_count": 15, "curation_gate_passed": 15, "dpo_pair_count": 89, "dpo_rejected_report_count": 89, "grpo_process_task_count": 94, "manifest_grpo_task_count": 94, "mean_premise_recall": 1.0, "process_reward_components": ["closed_goals", "first_error", "forbidden_admit", "forbidden_axiom", "forbidden_sorry", "forbidden_unsafe", "locally_valid_steps", "premises_used", "proof_complete", "rejected", "timeout"], "sft_example_count": 89}, "full_system_ready": true, "heldout_pass_rate": 1.0, "notes": "P8.M3 report: artifact-backed ablation readiness for retrieval, SFT, DPO, Lean process reward, and curation. This is an auditable system component ablation scaffold, not a trained-model performance claim.", "report_id": "ablation::p8"}
